{
  "version": "2.1.0",
  "updatedAt": "2026-09-21",
  "sources": [
    "https://publication.pravo.gov.ru/document/0001201212300007",
    "https://sfr.gov.ru/grazhdanam/pensioneram/socialnaya_doplata_do_prozhitochnogo_minimuma",
    "https://sfr.gov.ru/grazhdanam/dop_info/prozhitochniy_min_pensionery/",
    "https://sfr.gov.ru/grazhdanam/svo_new/lgoty_pensii_vyplaty_uchastnikam_veteranam",
    "https://sfr.gov.ru/grazhdanam/svo_new/pensii_vyplaty_semyam_pogibshih"
  ],
  "categories": [
    {
      "id": "parent",
      "title": "Родитель",
      "description": "Выплаты и меры поддержки для семей с детьми."
    },
    {
      "id": "student",
      "title": "Студент",
      "description": "Государственная социальная стипендия и другие меры поддержки обучающихся."
    },
    {
      "id": "pensioner",
      "title": "Пенсионер",
      "description": "Социальная доплата к пенсии и проверка права на неё."
    },
    {
      "id": "svo_veteran_family",
      "title": "СВО / ветеран / семья",
      "description": "Федеральные и региональные меры поддержки участников СВО, ветеранов и членов их семей."
    }
  ],
  "scenarios": [
    {
      "id": "parent_unified_allowance_refusal",
      "categoryId": "parent",
      "title": "Мне отказали в едином пособии на ребёнка. Почему и что делать?",
      "description": "Пошаговый разбор причины отказа по ответам и тексту решения.",
      "engine": "reason_matcher",
      "questionsRef": "parent_unified_allowance",
      "result": {
        "note": "Это информационная подсказка. Официальную причину и порядок обжалования нужно сверять с решением ведомства."
      }
    },
    {
      "id": "student_social_scholarship_refusal",
      "categoryId": "student",
      "title": "Мне отказали в государственной социальной стипендии. Почему и что делать?",
      "description": "Проверяет форму обучения, основание для социальной стипендии и подтверждающие документы.",
      "engine": "guided",
      "sources": [
        "https://publication.pravo.gov.ru/document/0001201212300007",
        "https://www.consultant.ru/document/cons_doc_LAW_140174/fc74ef70a4fc3107df5b2b18636ac5f74e3d0a73/",
        "https://www.consultant.ru/document/cons_doc_LAW_543409/"
      ],
      "questions": [
        {
          "id": "studyForm",
          "text": "Вы учитесь очно?",
          "type": "choice",
          "options": [
            {
              "value": "full_time",
              "label": "Да, очно",
              "next": "fundingSource"
            },
            {
              "value": "other_form",
              "label": "Нет, другая форма",
              "resultId": "outside_federal_scope"
            }
          ]
        },
        {
          "id": "fundingSource",
          "text": "Как вы обучаетесь по финансированию?",
          "type": "choice",
          "options": [
            {
              "value": "budget",
              "label": "За счёт бюджета",
              "next": "basis"
            },
            {
              "value": "paid",
              "label": "Платно",
              "resultId": "check_local_rules"
            },
            {
              "value": "unknown",
              "label": "Не знаю",
              "resultId": "funding_clarification"
            }
          ]
        },
        {
          "id": "basis",
          "text": "На каком основании вы претендуете на государственную социальную стипендию?",
          "type": "choice",
          "options": [
            {
              "value": "orphan",
              "label": "Сирота / оставшийся без попечения родителей",
              "next": "basisProof"
            },
            {
              "value": "disability",
              "label": "Инвалидность",
              "next": "basisProof"
            },
            {
              "value": "lost_parents",
              "label": "Потерял(а) обоих или единственного родителя во время обучения",
              "next": "basisProof"
            },
            {
              "value": "veteran_military",
              "label": "Ветеран / инвалид вследствие военной травмы / иной военный статус из закона",
              "next": "basisProof"
            },
            {
              "value": "state_social_help",
              "label": "Получил(а) государственную социальную помощь",
              "next": "basisProof"
            },
            {
              "value": "other",
              "label": "Другое / не знаю",
              "resultId": "check_local_rules"
            }
          ]
        },
        {
          "id": "basisProof",
          "text": "У вас есть документ, подтверждающий это основание?",
          "type": "choice",
          "options": [
            {
              "value": "yes",
              "label": "Да",
              "next": "refusalReason"
            },
            {
              "value": "no",
              "label": "Нет",
              "resultId": "missing_confirmation"
            },
            {
              "value": "unknown",
              "label": "Не знаю",
              "resultId": "check_documents"
            }
          ]
        },
        {
          "id": "refusalReason",
          "text": "Что ближе всего к формулировке отказа?",
          "type": "choice",
          "options": [
            {
              "value": "proof_not_accepted",
              "label": "Не приняли или не учли подтверждающий документ",
              "next": "refusalTextDocument"
            },
            {
              "value": "social_help_not_counted",
              "label": "Не учли документ о государственной социальной помощи",
              "next": "refusalTextSocialHelp"
            },
            {
              "value": "formal_requirements",
              "label": "Отказали по формальному основанию / правилам организации",
              "next": "refusalTextFormal"
            },
            {
              "value": "unknown",
              "label": "Не знаю",
              "next": "refusalTextGeneric"
            }
          ]
        },
        {
          "id": "refusalTextDocument",
          "text": "Напишите 1–2 предложения из решения об отказе. Это поможет сверить формулировку.",
          "type": "text",
          "next": "result:document_dispute"
        },
        {
          "id": "refusalTextSocialHelp",
          "text": "Напишите 1–2 предложения из решения об отказе.",
          "type": "text",
          "next": "result:social_help_document"
        },
        {
          "id": "refusalTextFormal",
          "text": "Напишите 1–2 предложения из решения об отказе.",
          "type": "text",
          "next": "result:formal_refusal"
        },
        {
          "id": "refusalTextGeneric",
          "text": "Напишите 1–2 предложения из решения об отказе.",
          "type": "text",
          "next": "result:documented_refusal"
        }
      ],
      "results": {
        "outside_federal_scope": {
          "title": "Проверьте правила именно вашей формы обучения",
          "explanation": "Федеральная норма о назначении государственной социальной стипендии в статье 36 Закона № 273-ФЗ привязана к очной форме обучения за счёт бюджета. Для других форм обучения могут действовать иные правила вуза, региона или работодателя.",
          "actions": [
            "Попросите учебную организацию указать нормативный акт, по которому вам отказали.",
            "Уточните, есть ли в вузе или колледже собственные меры материальной поддержки.",
            "Сохраните решение об отказе и локальный акт о стипендиальном обеспечении."
          ],
          "documents": [
            "Решение об отказе",
            "Локальный акт об обучении и стипендиях",
            "Документы, подтверждающие вашу ситуацию"
          ],
          "whereToApply": "Учебная организация; при необходимости — орган образования субъекта РФ",
          "legalRef": "Федеральный закон № 273-ФЗ, статья 36"
        },
        "check_local_rules": {
          "title": "Нужна проверка правил конкретной организации",
          "explanation": "Размеры и порядок назначения стипендий зависят в том числе от уровня образования, источника финансирования и правил организации. Поэтому по одной только категории «студент» нельзя подтвердить право на государственную социальную стипендию.",
          "actions": [
            "Запросите письменное основание отказа.",
            "Попросите показать локальный акт о стипендиальном обеспечении.",
            "Сверьте требования к форме обучения, финансированию и категории получателя."
          ],
          "documents": [
            "Решение об отказе",
            "Локальный акт организации",
            "Подтверждение статуса студента"
          ],
          "whereToApply": "Учебная организация",
          "legalRef": "Федеральный закон № 273-ФЗ, статья 36"
        },
        "funding_clarification": {
          "title": "Сначала уточните источник финансирования",
          "explanation": "Для применения федерального порядка государственной академической и социальной стипендии важна форма обучения и источник финансирования. Уточните эти сведения до повторного обращения.",
          "actions": [
            "Получите в деканате или учебной части справку о форме обучения.",
            "Уточните, финансируется ли обучение за счёт бюджетных ассигнований.",
            "После уточнения попросите пересмотреть отказ с учётом этих сведений."
          ],
          "documents": [
            "Справка об обучении",
            "Решение об отказе"
          ],
          "whereToApply": "Учебная организация",
          "legalRef": "Федеральный закон № 273-ФЗ, статья 36"
        },
        "missing_confirmation": {
          "title": "Не хватает подтверждения основания",
          "explanation": "Для категории, указанной в статье 36 Закона № 273-ФЗ, организация должна иметь подтверждение основания назначения социальной стипендии. Без него отказ может быть связан с отсутствием подтверждающих сведений.",
          "actions": [